{
  "$schema": "http://json-schema.org/draft-07/schema#",
  "$id": "harness-registry.schema.json",
  "title": "Harness Registry (post-orchestrator, v3)",
  "description": "Shape of manifests/harness.registry.json after the 2026-08-25 orchestrator removal. The v2 orchestrator-era schema (primary_orchestrators / downstream_gates / name_freeze / decision_semantics) lives at tag pre-orchestrator-removal.",
  "type": "object",
  "required": ["schema_version", "description", "evidence_kit", "hooks", "skills"],
  "additionalProperties": true,
  "properties": {
    "schema_version": { "type": "string", "pattern": "^3\\.\\d+\\.\\d+$" },
    "generated_date": { "type": "string" },
    "generated_by": { "type": "string" },
    "description": { "type": "string" },
    "primary_orchestrators": {
      "type": "array",
      "maxItems": 0,
      "description": "Must stay empty. A non-empty list means an orchestrator was reintroduced without redesigning the registry — bump schema_version instead."
    },
    "evidence_kit": {
      "type": "object",
      "required": ["sdks", "agents", "evidence_roots"],
      "properties": {
        "sdks": { "type": "array", "items": { "type": "string" }, "minItems": 1 },
        "validators_dir": { "type": "string" },
        "shared_runtime": { "type": "string" },
        "agents": { "type": "array", "items": { "type": "string" }, "minItems": 1 },
        "evidence_roots": { "type": "array", "items": { "type": "string" } },
        "note": { "type": "string" }
      }
    },
    "hooks": {
      "type": "object",
      "required": ["registry"],
      "properties": { "registry": { "type": "string" } }
    },
    "skills": {
      "type": "object",
      "required": ["index"],
      "properties": {
        "index": { "type": "string" },
        "visibility_policy": { "type": "string" }
      }
    }
  }
}
